{
  "pitch": [
    {
      "text": "Retrieval-augmented readers treat every retrieved passage as equally trustworthy; this paper shows a tiny gate in front of the reader buys 2-3 EM points, ",
      "cites": [
        "ch01/p002",
        "ch04/s02/p001"
      ]
    },
    {
      "text": "which makes it a good case for asking whether cheap filtering beats bigger readers.",
      "cites": [
        "ch01/p004"
      ]
    }
  ],
  "key_figure": {
    "anchor": "ch03/f001",
    "why": [
      {
        "text": "The pipeline figure: point at where the gate sits between retriever and reader, then ask what it can never fix — a passage the retriever missed.",
        "cites": [
          "ch03/f001",
          "ch03/p001"
        ]
      }
    ]
  },
  "weakest_assumption": {
    "spans": [
      {
        "text": "That the relevant passage is among those retrieved: the gate can only down-weight, never recover, evidence, ",
        "cites": [
          "ch03/p001"
        ]
      },
      {
        "text": "and the paper never measures how often retrieval misses.",
        "cites": [
          "ch04/p001"
        ]
      }
    ]
  },
  "questions": [
    [
      {
        "text": "Is the gate doing anything a reranker on the retriever's scores could not?",
        "cites": [
          "ch02/p003",
          "ch03/s01/p002"
        ]
      }
    ],
    [
      {
        "text": "Why does the gain double on multi-hop HotpotQA?",
        "cites": [
          "ch04/s02/p001"
        ]
      }
    ],
    [
      {
        "text": "Would you trust gains measured only on development sets?",
        "cites": [
          "ch04/p001"
        ]
      }
    ],
    [
      {
        "text": "What happens when the gate is trained on one benchmark and used on another?",
        "cites": [
          "ch05/p002"
        ]
      }
    ],
    [
      {
        "text": "Is a 0.3 EM lead within ±0.4 a result?",
        "cites": [
          "ch04/s02/p002"
        ]
      }
    ]
  ],
  "debate": {
    "for": [
      [
        {
          "text": "Consistent gains on two benchmarks against re-run baselines.",
          "cites": [
            "ch04/s02/t001",
            "ch04/s01/p002"
          ]
        }
      ],
      [
        {
          "text": "The adapter is 40% smaller than the one it beats.",
          "cites": [
            "ch04/s02/p003"
          ]
        }
      ]
    ],
    "against": [
      [
        {
          "text": "No test-set numbers; the development sets also chose the model.",
          "cites": [
            "ch04/p001"
          ]
        }
      ],
      [
        {
          "text": "The gate is retrained per benchmark, so the method is less general than it looks.",
          "cites": [
            "ch05/p002"
          ]
        }
      ]
    ]
  }
}
